{"regression_id":"EQA-REG-0001","reported_at":"2026-08-14T00:00:00Z","reported_by":"owner","source":"evaluation","summary":"","change_type":"","affected_rule_ids":[],"fixture_ids":[],"expected_behavior":"","observed_behavior":"","severity":"moderate","status":"new","owner":"","retest_required":true,"retest_result":null,"closed_at":null}
